{
  "schema_version": 1,
  "id": "nightmare_tempest_mephis",
  "name": {
    "en": "Nightmare: Tempest Mephis"
  },
  "icon": "echoes/nightmare_tempest_mephis/icon.png",
  "source": {
    "site": "Wuthering Waves Wiki",
    "page_url": "https://wutheringwaves.fandom.com/wiki/Nightmare%3A_Tempest_Mephis",
    "verified_at": "2026-10-02",
    "revision_id": 80560
  }
}
