{
  "schema_version": 1,
  "id": "nightmare_feilian_beringal",
  "name": {
    "en": "Nightmare: Feilian Beringal"
  },
  "icon": "echoes/nightmare_feilian_beringal/icon.png",
  "source": {
    "site": "Wuthering Waves Wiki",
    "page_url": "https://wutheringwaves.fandom.com/wiki/Nightmare%3A_Feilian_Beringal",
    "verified_at": "2026-10-02",
    "revision_id": 80554
  }
}
