{
  "schema_version": 1,
  "id": "lampylumen_myriad",
  "name": {
    "en": "Lampylumen Myriad"
  },
  "icon": "echoes/lampylumen_myriad/icon.png",
  "source": {
    "site": "Wuthering Waves Wiki",
    "page_url": "https://wutheringwaves.fandom.com/wiki/Lampylumen_Myriad",
    "verified_at": "2026-10-02",
    "revision_id": 80316
  }
}
