{
  "schema_version": 1,
  "id": "corrosaurus",
  "name": {
    "en": "Corrosaurus"
  },
  "icon": "echoes/corrosaurus/icon.png",
  "source": {
    "site": "Wuthering Waves Wiki",
    "page_url": "https://wutheringwaves.fandom.com/wiki/Corrosaurus",
    "verified_at": "2026-10-02",
    "revision_id": 80053
  }
}
