{
  "schema_version": 1,
  "id": "calamity_effigy",
  "name": {
    "en": "Calamity Effigy"
  },
  "icon": "echoes/calamity_effigy/icon.png",
  "source": {
    "site": "Wuthering Waves Wiki",
    "page_url": "https://wutheringwaves.fandom.com/wiki/Calamity_Effigy",
    "verified_at": "2026-10-02",
    "revision_id": 144477
  }
}
