{
  "schema_version": 1,
  "id": "nightmare_thundering_mephis",
  "name": {
    "en": "Nightmare: Thundering Mephis"
  },
  "icon": "echoes/nightmare_thundering_mephis/icon.png",
  "source": {
    "site": "Wuthering Waves Wiki",
    "page_url": "https://wutheringwaves.fandom.com/wiki/Nightmare%3A_Thundering_Mephis",
    "verified_at": "2026-10-02",
    "revision_id": 80561
  }
}
