{
  "schema_version": 1,
  "id": "nightmare_lampylumen_myriad",
  "name": {
    "en": "Nightmare: Lampylumen Myriad"
  },
  "icon": "echoes/nightmare_lampylumen_myriad/icon.png",
  "source": {
    "site": "Wuthering Waves Wiki",
    "page_url": "https://wutheringwaves.fandom.com/wiki/Nightmare%3A_Lampylumen_Myriad",
    "verified_at": "2026-10-02",
    "revision_id": 80558
  }
}
